id,type,name,status,description,startTime,duration,epic
1,TASK,Отправить ТЗ6 на ревью,NEW,Завершить отладку не позднее 10:00 26.01,01.01.2000--12:00,3600
2,EPIC,Стрим 7. Пройти,NEW,к 5.02 пройти все уроки и отправить ТЗ7 на ревью,
3,SUBTASK,Начать тренажёр,DONE,Пройти первый урок,01.01.2000--12:00,3600,2
4,SUBTASK,Пройти все уроки тренажёра,IN_PROGRESS,изучать теорию и проходить упражнения,01.01.2000--12:00,3600,2
5,SUBTASK,Изучать дополнительные материалы по темам,NEW,stepic литература,01.01.2000--12:00,3600,2
6,TASK,Поздравить А.Е. в д.р.,NEW,Позвонить,01.01.2000--12:00,3600
7,TASK,Гитарный конкурс в Питере,NEW,Купить билеты,01.01.2000--12:00,3600

3,2,6,5,1